
a)DML INSERT
------------
1.

mysql> create table employee(empid int,empname varchar(15),position varchar(15));
Query OK, 0 rows affected (0.02 sec)

mysql> desc employee;
+----------+-------------+------+-----+---------+-------+
| Field    | Type        | Null | Key | Default | Extra |
+----------+-------------+------+-----+---------+-------+
| empid    | int         | YES  |     | NULL    |       |
| empname  | varchar(15) | YES  |     | NULL    |       |
| position | varchar(15) | YES  |     | NULL    |       |
+----------+-------------+------+-----+---------+-------+
3 rows in set (0.00 sec)

mysql> insert into employee values(1001,'john','manager'),(1002,'james','developer'),(1003,'nithya','teamleader');
Query OK, 3 rows affected (0.01 sec)
Records: 3  Duplicates: 0  Warnings: 0

mysql> select * from employee;
+-------+---------+------------+
| empid | empname | position   |
+-------+---------+------------+
|  1001 | john    | manager    |
|  1002 | james   | developer  |
|  1003 | nithya  | teamleader |
+-------+---------+------------+
3 rows in set (0.00 sec)

2.
mysql> create table student(rollno int, name varchar(15),age int);
Query OK, 0 rows affected (0.01 sec)

mysql> desc student;
+--------+-------------+------+-----+---------+-------+
| Field  | Type        | Null | Key | Default | Extra |
+--------+-------------+------+-----+---------+-------+
| rollno | int         | YES  |     | NULL    |       |
| name   | varchar(15) | YES  |     | NULL    |       |
| age    | int         | YES  |     | NULL    |       |
+--------+-------------+------+-----+---------+-------+
3 rows in set (0.01 sec)
mysql> insert into student values(01,'jasna',20),(02,'sheikha',20),(03,'aswini',21);
Query OK, 3 rows affected (0.01 sec)
Records: 3  Duplicates: 0  Warnings: 0

mysql> select * from student;
+--------+---------+------+
| rollno | name    | age  |
+--------+---------+------+
|      1 | jasna   |   20 |
|      2 | sheikha |   20 |
|      3 | aswini  |   21 |
+--------+---------+------+
3 rows in set (0.00 sec)



mysql>  insert  into customer2 values(1001,'Jasna','Vazhayil','Kozhikode',9544158360),(1002,'Punya','Chandakkunnu','Trivandrum',9846772233),(1003,'anu','Kizhkkayil','Trivandrum',904050131313),(1004,'Shaikha','Meleveetil','Malappuram',9946868990),(1005,'Saniya','Vdakkayil','Kozhikode',8978665543);
Query OK, 5 rows affected (0.00 sec)
Records: 5  Duplicates: 0  Warnings: 0

mysql> insert into customer2(id,name,address,city)values(1006,'Sahva','Nalakath','Trissur'),(1007,'Naira','Sopanam','Ernakulam');
Query OK, 2 rows affected (0.00 sec)
Records: 2  Duplicates: 0  Warnings: 0

mysql> insert into product2 values(101,'Keyboard',500);
Query OK, 1 row affected (0.00 sec)

mysql> insert into product2 values(102,'A4paper',20);
Query OK, 1 row affected (0.01 sec)

mysql> insert into product2 values(103,'pen',10);
Query OK, 1 row affected (0.00 sec)

mysql> insert into product2 values(104,'ink',350);
Query OK, 1 row affected (0.00 sec)

mysql> insert into product2 values(105,'eraser',5);
Query OK, 1 row affected (0.00 sec)

mysql> insert into invoice_master
   values (201, 1001, '2025-02-01');
Query OK, 1 row affected (0.00 sec)

mysql> insert into invoice_master values(202, 1001, '2025-03-03');
Query OK, 1 row affected (0.01 sec)

mysql> insert into invoice_master values (203, 1002, '2025-03-04');
Query OK, 1 row affected (0.00 sec)

mysql> insert into invoice_master values (204, 1002, '2025-04-04');
Query OK, 1 row affected (0.00 sec)

mysql>insert into invoice_master values(205, 1002, '2025-04-05');
Query OK, 1 row affected (0.01 sec)

mysql> insert into invoice_master values (206, 1002, '2025-05-05');
Query OK, 1 row affected (0.01 sec)

mysql> insert into  invoice_master values (208, 1003, '2025-05-05');
Query OK, 1 row affected (0.00 sec)

mysql> insert into  invoice_master values (209, 1003, '2025-05-06');
Query OK, 1 row affected (0.00 sec)

mysql> insert into invoice_master values(210, 1003, '2025-06-06');
Query OK, 1 row affected (0.00 sec)

mysql> insert into invoice_master values(211, 1004, '2025-06-06');
Query OK, 1 row affected (0.00 sec)

mysql> insert into  invoice_master values(212, 1005, '2025-06-07');
Query OK, 1 row affected (0.00 sec)

mysql> insert into  invoice_master values (213, 1006, '2025-07-07');
Query OK, 1 row affected (0.00 sec)

mysql> insert into invoice_master values (214, 1007, '2025-07-08');
Query OK, 1 row affected (0.00 sec)


mysql> insert into  invoice_item values (201, 101, 2);
Query OK, 1 row affected (0.01 sec)

mysql> insert into  invoice_item values (202, 101, 3);
Query OK, 1 row affected (0.00 sec)

mysql> insert into invoice_item values(203, 101, 3);
Query OK, 1 row affected (0.00 sec)

mysql> insert into  invoice_item values(204, 102, 1);
Query OK, 1 row affected (0.00 sec)

mysql> insert into  invoice_item values (205, 102, 4);
Query OK, 1 row affected (0.00 sec)

mysql> insert into  invoice_item values (206, 102, 4);
Query OK, 1 row affected (0.01 sec)

mysql> insert into  invoice_item values (208, 104, 3);
Query OK, 1 row affected (0.00 sec)

mysql> select* from customer2;
+------+---------+--------------+------------+--------------+
| id   | name    | address      | city       | ph_no        |
+------+---------+--------------+------------+--------------+
| 1001 | Jasna   | Vazhayil     | calicut    | 9544158360   |
| 1002 | Punya   | Chandakkunnu | Trivandrum | 9846772233   |
| 1003 | anu     | Kizhkkayil   | Trivandrum | 904050131313 |
| 1004 | Shaikha | Meleveetil   | Malappuram | 9946868990   |
| 1005 | Saniya  | Vdakkayil    | Kozhikode  | 8978665543   |
| 1006 | Sahva   | Nalakath     | Trissur    | NULL         |
| 1007 | Naira   | Sopanam      | Ernakulam  | NULL         |
+------+---------+--------------+------------+--------------+

mysql> select *from product2;
+-----+----------+-------+
| pid | pname    | price |
+-----+----------+-------+
| 101 | Keyboard |   600 |
| 102 | A4paper  |    20 |
| 103 | pen      |    10 |
| 104 | ink      |   350 |
| 105 | eraser   |     5 |
+-----+----------+-------+
5 rows in set (0.00 sec)

mysql> select *from invoice_master;
+--------+------+------------+
| inv_id | id   | inv_date   |
+--------+------+------------+
|    201 | 1001 | 2025-02-01 |
|    202 | 1001 | 2025-03-03 |
|    203 | 1002 | 2025-03-04 |
|    204 | 1002 | 2025-04-04 |
|    205 | 1002 | 2025-04-05 |
|    206 | 1002 | 2025-05-05 |
|    208 | 1003 | 2025-05-05 |
|    209 | 1003 | 2025-05-06 |
|    210 | 1003 | 2025-06-06 |
|    211 | 1004 | 2025-06-06 |
|    212 | 1005 | 2025-06-07 |
|    213 | 1006 | 2025-07-07 |
|    214 | 1007 | 2025-07-08 |
+--------+------+------------+
13 rows in set (0.00 sec)
mysql> select *from invoice_item;
+--------+------+----------+
| inv_id | pid  | quantity |
+--------+------+----------+
|    201 |  101 |        2 |
|    202 |  101 |        3 |
|    203 |  101 |        3 |
|    204 |  102 |        1 |
|    205 |  102 |        4 |
|    206 |  102 |        4 |
|    208 |  104 |        3 |
+--------+------+----------+
7 rows in set (0.00 sec)


7 rows in set (0.00 sec)

b)DML UPDATE
-----------
1.
mysql> select * from product2;
+-----+----------+-------+
| pid | pname    | price |
+-----+----------+-------+
| 101 | Keyboard |   500 |
| 102 | A4paper  |    20 |
| 103 | pen      |    10 |
| 104 | ink      |   350 |
| 105 | eraser   |     5 |
+-----+----------+-------+
mysql> update product2 set price=600 where pid=101;
Query OK, 1 row affected (0.00 sec)
Rows matched: 1  Changed: 1  Warnings: 0

mysql> select* from product2;
+-----+----------+-------+
| pid | pname    | price |
+-----+----------+-------+
| 101 | Keyboard |   600 |
| 102 | A4paper  |    20 |
| 103 | pen      |    10 |
| 104 | ink      |   350 |
| 105 | eraser   |     5 |
+-----+----------+-------+
5 rows in set (0.00 sec)
2.
mysql> select* from customer2;
+------+---------+--------------+------------+--------------+
| id   | name    | address      | city       | ph_no        |
+------+---------+--------------+------------+--------------+
| 1001 | Jasna   | Vazhayil     | calicut    | 9544158360   |
| 1002 | Punya   | Chandakkunnu | Trivandrum | 9846772233   |
| 1003 | anu     | Kizhkkayil   | Trivandrum | 904050131313 |
| 1004 | Shaikha | Meleveetil   | Malappuram | 9946868990   |
| 1005 | Saniya  | Vdakkayil    | Kozhikode  | 8978665543   |
| 1006 | Sahva   | Nalakath     | Trissur    | NULL         |
| 1007 | Naira   | Sopanam      | Ernakulam  | NULL         |
+------+---------+--------------+------------+--------------+
7 rows in set (0.00 sec)


mysql> update customer2 set city='kozhikode' where  id=1001;
Query OK, 1 row affected (0.01 sec)
Rows matched: 1  Changed: 1  Warnings: 0

mysql> select* from customer2;
+------+---------+--------------+------------+--------------+
| id   | name    | address      | city       | ph_no        |
+------+---------+--------------+--------mysql> select* from product2;
+-----+----------+-------+
| pid | pname    | price |
+-----+----------+-------+
| 101 | Keyboard |   600 |
| 102 | A4paper  |    20 |
| 103 | pen      |    10 |
| 104 | ink      |   350 |
| 105 | eraser   |     5 |
+-----+----------+-------+
5 rows in set (0.00 sec)----+--------------+
| 1001 | Jasna   | Vazhayil     | kozhikode  | 9544158360   |
| 1002 | Punya   | Chandakkunnu | Trivandrum | 9846772233   |
| 1003 | anu     | Kizhkkayil   | Trivandrum | 904050131313 |
| 1004 | Shaikha | Meleveetil   | Malappuram | 9946868990   |
| 1005 | Saniya  | Vdakkayil    | Kozhikode  | 8978665543   |
| 1006 | Sahva   | Nalakath     | Trissur    | NULL         |
| 1007 | Naira   | Sopanam      | Ernakulam  | NULL         |
+------+---------+--------------+------------+--------------+
7 rows in set (0.00 sec)
3.update all prices with 2% increase of its original price
mysql> select* from product2;
+-----+----------+-------+
| pid | pname    | price |
+-----+----------+-------+
| 101 | Keyboard |   600 |
| 102 | A4paper  |    20 |
| 103 | pen      |    10 |
| 104 | ink      |   350 |
| 105 | eraser   |     5 |
+-----+----------+-------+
5 rows in set (0.00 sec)
mysql> update product2 set price=price+(price*0.02);
Query OK, 2 rows affected (0.01 sec)
Rows matched: 5  Changed: 2  Warnings: 0

mysql> select* from product2;
+-----+----------+-------+
| pid | pname    | price |
+-----+----------+-------+
| 101 | Keyboard |   612 |
| 102 | A4paper  |    20 |
| 103 | pen      |    10 |
| 104 | ink      |   357 |
| 105 | eraser   |     5 |
+-----+----------+-------+
5 rows in set (0.00 sec)
4.change the address ,city,phone number of a particular customer
mysql> select*from customer2;
+------+---------+--------------+------------+--------------+
| id   | name    | address      | city       | ph_no        |
+------+---------+--------------+------------+--------------+
| 1001 | Jasna   | Vazhayil     | kozhikode  | 9544158360   |
| 1002 | Punya   | Chandakkunnu | Trivandrum | 9846772233   |
| 1003 | anu     | Kizhkkayil   | Trivandrum | 904050131313 |
| 1004 | Shaikha | Meleveetil   | Malappuram | 9946868990   |
| 1005 | Saniya  | Vdakkayil    | Kozhikode  | 8978665543   |
| 1006 | Sahva   | Nalakath     | Trissur    | NULL         |
| 1007 | Naira   | Sopanam      | Ernakulam  | NULL         |
+------+---------+--------------+------------+--------------+
7 rows in set (0.00 sec)
mysql> update customer2  set address='tharol',city='kochi',ph_no=9846153680 where id=1001;
Query OK, 1 row affected (0.00 sec)
Rows matched: 1  Changed: 1  Warnings: 0

mysql> select*from customer2;
+------+---------+--------------+------------+--------------+
| id   | name    | address      | city       | ph_no        |
+------+---------+--------------+------------+--------------+
| 1001 | Jasna   | tharol       | kochi      | 9846153680   |
| 1002 | Punya   | Chandakkunnu | Trivandrum | 9846772233   |
| 1003 | anu     | Kizhkkayil   | Trivandrum | 904050131313 |
| 1004 | Shaikha | Meleveetil   | Malappuram | 9946868990   |
| 1005 | Saniya  | Vdakkayil    | Kozhikode  | 8978665543   |
| 1006 | Sahva   | Nalakath     | Trissur    | NULL         |
| 1007 | Naira   | Sopanam      | Ernakulam  | NULL         |
+------+---------+--------------+------------+--------------+
7 rows in set (0.00 sec)
5.change the quantity of purchased product of inv_id '201'

mysql> select *from invoice_item;
+--------+------+----------+
| inv_id | pid  | quantity |
+--------+------+----------+
|    201 |  101 |        2 |
|    202 |  101 |        3 |
|    203 |  101 |        3 |
|    204 |  102 |        1 |
|    205 |  102 |        4 |
|    206 |  102 |        4 |
|    208 |  104 |        3 |
+--------+------+----------+
7 rows in set (0.00 sec)
mysql> update invoice_item set quantity=5 where inv_id=201;
Query OK, 1 row affected (0.00 sec)
Rows matched: 1  Changed: 1  Warnings: 0

mysql> select *from invoice_item;
+--------+------+----------+
| inv_id | pid  | quantity |
+--------+------+----------+
|    201 |  101 |        5 |
|    202 |  101 |        3 |
|    203 |  101 |        3 |
|    204 |  102 |        1 |
|    205 |  102 |        4 |
|    206 |  102 |        4 |
|    208 |  104 |        3 |
+--------+------+----------+
7 rows in set (0.00 sec)
c)DML DELETE
1.Delete the record of customer id'1001'
----------------------------------------

mysql> select*from customer2;
+------+---------+--------------+------------+--------------+
| id   | name    | address      | city       | ph_no        |
+------+---------+--------------+------------+--------------+
| 1001 | Jasna   | tharol       | kochi      | 9846153680   |
| 1002 | Punya   | Chandakkunnu | Trivandrum | 9846772233   |
| 1003 | anu     | Kizhkkayil   | Trivandrum | 904050131313 |
| 1004 | Shaikha | Meleveetil   | Malappuram | 9946868990   |
| 1005 | Saniya  | Vdakkayil    | Kozhikode  | 8978665543   |
| 1006 | Sahva   | Nalakath     | Trissur    | NULL         |
| 1007 | Naira   | Sopanam      | Ernakulam  | NULL         |
+------+---------+--------------+------------+--------------+
7 rows in set (0.00 sec)


mysql> delete from invoice_item where inv_id = 201;
                 
Query OK, 2 rows affected (0.01 sec)

mysql> delete from invoice_master where id= = 201;
    
Query OK, 2 rows affected (0.00 sec)

mysql> delete from customer2 
    -> where id = 1001;
Query OK, 1 row affected (0.00 sec)
mysql> select * from customer2;
+------+---------+--------------+------------+--------------+
| id   | name    | address      | city       | ph_no        |
+------+---------+--------------+------------+--------------+
| 1002 | Punya   | Chandakkunnu | Trivandrum | 9846772233   |
| 1003 | anu     | Kizhkkayil   | Trivandrum | 904050131313 |
| 1004 | Shaikha | Meleveetil   | Malappuram | 9946868990   |
| 1005 | Saniya  | Vdakkayil    | Kozhikode  | 8978665543   |
| 1006 | Sahva   | Nalakath     | Trissur    | NULL         |
| 1007 | Naira   | Sopanam      | Ernakulam  | NULL         |
+------+---------+--------------+------------+--------------+
6 rows in set (0.00 sec)

2.Delete all purchase details of items whose quantity less than 2
--------------------------------------------------------------------

mysql> select *from invoice_item;
+--------+------+----------+
| inv_id | pid  | quantity |
+--------+------+----------+
|    203 |  101 |        3 |
|    204 |  102 |        1 |
|    205 |  102 |        4 |
|    206 |  102 |        4 |
|    208 |  104 |        3 |
+--------+------+----------+
5 rows in set (0.00 sec)

mysql> delete from invoice_item where quantity<2;
Query OK, 1 row affected (0.00 sec)

mysql> select *from invoice_item;
+--------+------+----------+
| inv_id | pid  | quantity |
+--------+------+----------+
|    203 |  101 |        3 |
|    205 |  102 |        4 |
|    206 |  102 |        4 |
|    208 |  104 |        3 |
+--------+------+----------+
4 rows in set (0.01 sec)

3.Delete the purchase details of product 'pen'in inv_id 203
-------------------------------------------------------------

mysql> select *from invoice_item;
+--------+------+----------+
| inv_id | pid  | quantity |
+--------+------+----------+
|    203 |  101 |        3 |
|    205 |  102 |        4 |
|    206 |  102 |        4 |
|    208 |  104 |        3 |
+--------+------+----------+
4 rows in set (0.01 sec)

mysql> delete from invoice_item where inv_id=203 and pid=101;
Query OK, 0 rows affected (0.00 sec)

mysql> select *from invoice_item;
+--------+------+----------+
| inv_id | pid  | quantity |
+--------+------+----------+
|    205 |  102 |        4 |
|    206 |  102 |        4 |
|    208 |  104 |        3 |
+--------+------+----------+
3 rows in set (0.00 sec)


4.Delete details of customer who does not have phone number
------------------------------------------------------------

mysql> SELECT * FROM customer2;
+------+---------+--------------+------------+--------------+
| id   | name    | address      | city       | ph_no        |
+------+---------+--------------+------------+--------------+
| 1002 | Punya   | Chandakkunnu | Trivandrum | 9846772233   |
| 1003 | anu     | Kizhkkayil   | Trivandrum | 904050131313 |
| 1004 | Shaikha | Meleveetil   | Malappuram | 9946868990   |
| 1005 | Saniya  | Vdakkayil    | Kozhikode  | 8978665543   |
| 1006 | Sahva   | Nalakath     | Trissur    | NULL         |
| 1007 | Naira   | Sopanam      | Ernakulam  | NULL         |
+------+---------+--------------+------------+--------------+
6 rows in set (0.00 sec)

mysql> delete from invoice_item where inv_id=213;
Query OK, 0 rows affected (0.00 sec)

mysql> delete from invoice_master where id =1006;
Query OK, 1 rows affected (0.00 sec)

mysql> delete from customer2 where ph_no is null;
Query OK, 1 rows affected (0.00 sec)

mysql> delete from invoice_item where inv_id=214;
Query OK, 0 rows affected (0.00 sec)

mysql> delete from invoice_master where id =1007;
Query OK, 1 rows affected (0.00 sec)

mysql> delete from customer2 where ph_no is null;
Query OK, 1 rows affected (0.00 sec)


mysql> select *from customer2;
+------+---------+--------------+------------+--------------+
| id   | name    | address      | city       | ph_no        |
+------+---------+--------------+------------+--------------+
| 1002 | Punya   | Chandakkunnu | Trivandrum | 9846772233   |
| 1003 | anu     | Kizhkkayil   | Trivandrum | 904050131313 |
| 1004 | Shaikha | Meleveetil   | Malappuram | 9946868990   |
| 1005 | Saniya  | Vdakkayil    | Kozhikode  | 8978665543   |
+------+---------+--------------+------------+--------------+
4 rows in set (0.00 sec)

5.Delete all records from student table
---------------------------------------

mysql> select *from student;
+--------+---------+------+
| rollno | name    | age  |
+--------+---------+------+
|      1 | jasna   |   20 |
|      2 | sheikha |   20 |
|      3 | aswini  |   21 |
+--------+---------+------+
3 rows in set (0.00 sec)

mysql> delete from student;
Query OK, 3 rows affected (0.00 sec)

mysql> select *from student;
Empty set (0.00 sec)

6.Delete invoice details of a particular customer 
--------------------------------------------------

mysql> delete from invoice_item where inv_id =204;
Query OK, 1 rows affected (0.00 sec)

mysql> delete from invoice_master where id=1002;
Query OK, 1 rows affected (0.00 sec)

mysql> delete from customer2 where name='punya';
Query OK, 1 row affected (0.00 sec)

mysql> select *from customer2;
+------+---------+------------+------------+--------------+
| id   | name    | address    | city       | ph_no        |
+------+---------+------------+------------+--------------+
| 1003 | anu     | Kizhkkayil | Trivandrum | 904050131313 |
| 1004 | Shaikha | Meleveetil | Malappuram | 9946868990   |
| 1005 | Saniya  | Vdakkayil  | Kozhikode  | 8978665543   |
+------+---------+------------+------------+--------------+
3 rows in set (0.00 sec)

7 delete the first two records of invoice_item table where  purchase quamtity is high
---------------------------------------------------------------------------------------


mysql> delete from invoice_item limit 2;
Query OK, 2 row affected (0.00 sec)


